<?xml version="1.0" encoding="UTF-8"?>
<hotel xmlns:xsi="http://www.w3.org/2001/XMLSchema-instance" xsi:noNamespaceSchemaLocation="hotel.xsd">
    <reserva>
        <numero_reserva>RES1001</numero_reserva>
        <unidade>PO</unidade>
        <hospede>
            <id_cliente>CLI001</id_cliente>
            <nome>Ana Silva</nome>
            <nif>123456789</nif>
            <email>ana.silva@email.com</email>
            <telefone>910000001</telefone>
        </hospede>
        <datas>
            <check_in>2026-02-10</check_in>
            <check_out>2026-02-15</check_out>
        </datas>
        <servicos_adicionais>
            <servico>
                <nome>Spa</nome>
                <preco>50.00</preco>
                <quantidade>2</quantidade>
            </servico>
            <servico>
                <nome>Jantar</nome>
                <preco>30.00</preco>
                <quantidade>1</quantidade>
            </servico>
        </servicos_adicionais>
        <valor_total>450.00</valor_total>
    </reserva>

    <reserva>
        <numero_reserva>RES1002</numero_reserva>
        <unidade>LS</unidade>
        <hospede>
            <id_cliente>HOS999</id_cliente>
            <nome>Carlos Sousa</nome>
            <nif>222333444</nif>
            <email>carlos.sousa@email.com</email>
            <telefone>960000002</telefone>
        </hospede>
        <datas>
            <check_in>2026-03-01</check_in>
            <check_out>2026-03-03</check_out>
        </datas>
        <servicos_adicionais>
            </servicos_adicionais>
        <valor_total>200.00</valor_total>
    </reserva>

    <reserva>
        <numero_reserva>RES1003</numero_reserva>
        <unidade>FR</unidade>
        <hospede>
            <id_cliente>TUR555</id_cliente>
            <nome>John Smith</nome>
            <nif>999888777</nif>
            <email>john.smith@email.com</email>
            <telefone>930000003</telefone>
        </hospede>
        <datas>
            <check_in>2026-06-10</check_in>
            <check_out>2026-06-20</check_out>
        </datas>
        <servicos_adicionais>
            <servico>
                <nome>Transporte</nome>
                <preco>25.00</preco>
                <quantidade>2</quantidade>
            </servico>
        </servicos_adicionais>
        <valor_total>1250.00</valor_total>
    </reserva>

    <reserva>
        <numero_reserva>RES1004</numero_reserva>
        <unidade>CB</unidade>
        <hospede>
            <id_cliente>CLI001</id_cliente>
            <nome>Ana Silva</nome>
            <nif>123456789</nif>
            <email>ana.silva@email.com</email>
            <telefone>910000001</telefone>
        </hospede>
        <datas>
            <check_in>2026-04-05</check_in>
            <check_out>2026-04-07</check_out>
        </datas>
        <servicos_adicionais>
            <servico>
                <nome>Spa</nome>
                <preco>40.00</preco>
                <quantidade>1</quantidade>
            </servico>
            <servico>
                <nome>Bar</nome>
                <preco>15.50</preco>
                <quantidade>4</quantidade>
            </servico>
        </servicos_adicionais>
        <valor_total>180.50</valor_total>
    </reserva>

    <reserva>
        <numero_reserva>RES1005</numero_reserva>
        <unidade>BR</unidade>
        <hospede>
            <id_cliente>EMP010</id_cliente>
            <nome>Maria Ferreira</nome>
            <nif>555444333</nif>
            <email>maria.ferreira@email.com</email>
            <telefone>920000005</telefone>
        </hospede>
        <datas>
            <check_in>2026-05-20</check_in>
            <check_out>2026-05-22</check_out>
        </datas>
        <servicos_adicionais>
            <servico>
                <nome>Jantar</nome>
                <preco>35.00</preco>
                <quantidade>2</quantidade>
            </servico>
        </servicos_adicionais>
        <valor_total>270.00</valor_total>
    </reserva>

    <reserva>
        <numero_reserva>RES1006</numero_reserva>
        <unidade>PO</unidade>
        <hospede>
            <id_cliente>VIP777</id_cliente>
            <nome>Roberto Lima</nome>
            <nif>111222333</nif>
            <email>roberto.lima@email.com</email>
            <telefone>911222333</telefone>
        </hospede>
        <datas>
            <check_in>2026-08-01</check_in>
            <check_out>2026-08-10</check_out>
        </datas>
        <servicos_adicionais>
            <servico>
                <nome>Spa</nome>
                <preco>60.00</preco>
                <quantidade>1</quantidade>
            </servico>
            <servico>
                <nome>Transporte</nome>
                <preco>20.00</preco>
                <quantidade>1</quantidade>
            </servico>
            <servico>
                <nome>Jantar</nome>
                <preco>40.00</preco>
                <quantidade>3</quantidade>
            </servico>
        </servicos_adicionais>
        <valor_total>980.00</valor_total>
    </reserva>
</hotel>